{
  "$schema": "https://json-schema.org/draft/2020-12/schema",
  "title": "Recon manifest — the attack surface the system discovered in the target",
  "description": "Emitted by the threat-model run. Every element carries grounding evidence (a path/glob/string that must resolve in the target) so the eval can check faithfulness without an answer key.",
  "type": "object",
  "required": ["system_name", "components", "data_stores", "entry_points", "trust_boundaries", "external_deps"],
  "properties": {
    "system_name": { "type": "string" },
    "components":       { "type": "array", "items": { "$ref": "#/$defs/element" } },
    "data_stores":      { "type": "array", "items": { "$ref": "#/$defs/element" } },
    "entry_points":     { "type": "array", "items": { "$ref": "#/$defs/element" } },
    "trust_boundaries": { "type": "array", "items": { "$ref": "#/$defs/element" } },
    "external_deps":    { "type": "array", "items": { "$ref": "#/$defs/element" } },
    "roles": {
      "type": "array",
      "description": "distinct roles/principals the LLM identified (incl. anonymous/unauthenticated). Lets the RBAC-matrix precondition gate on a declared fact.",
      "items": { "type": "object", "additionalProperties": false, "required": ["id", "name"],
        "properties": { "id": { "type": "string" }, "name": { "type": "string" } } }
    }
  },
  "$defs": {
    "element": {
      "type": "object",
      "required": ["id", "name", "evidence"],
      "properties": {
        "id":   { "type": "string", "description": "stable local id, e.g. C1 / D1 / E1 / TB1 / X1" },
        "name": { "type": "string" },
        "evidence": {
          "type": "array", "minItems": 1,
          "items": { "type": "string" },
          "description": "repo-relative path, glob, or literal source string that proves this element exists in the target"
        },
        "kind": {
          "enum": ["process", "network", "trust", "tenant", "cicd", "region"],
          "description": "trust_boundary only: the boundary class the LLM assigned (lets the eval reason about multi-zone chains without inferring it)"
        },
        "manifest": { "type": "string", "description": "external_dep only: path to the dependency manifest/lockfile in evidence (enables the SBOM precondition)" },
        "risk": { "type": "string", "description": "external_dep only: free-text risk note the LLM set (e.g. EOL, known-CVE) — a declared fact, not eval-inferred" }
      }
    }
  }
}
