{
  "system_name": "OWASP NodeGoat",
  "components": [
    {"id": "C1", "name": "Express HTTP server / app bootstrap", "evidence": ["server.js"]},
    {"id": "C2", "name": "Route index & middleware wiring (isLoggedIn / isAdmin)", "evidence": ["app/routes/index.js"]},
    {"id": "C3", "name": "Session/Auth handler (login, signup, logout)", "evidence": ["app/routes/session.js"]},
    {"id": "C4", "name": "Profile handler", "evidence": ["app/routes/profile.js"]},
    {"id": "C5", "name": "Contributions handler (eval of user input)", "evidence": ["app/routes/contributions.js"]},
    {"id": "C6", "name": "Allocations handler", "evidence": ["app/routes/allocations.js"]},
    {"id": "C7", "name": "Benefits handler", "evidence": ["app/routes/benefits.js"]},
    {"id": "C8", "name": "Memos handler", "evidence": ["app/routes/memos.js"]},
    {"id": "C9", "name": "Research handler (needle.get to user URL)", "evidence": ["app/routes/research.js"]},
    {"id": "C10", "name": "Tutorial router", "evidence": ["app/routes/tutorial.js"]},
    {"id": "C11", "name": "Error handler middleware", "evidence": ["app/routes/error.js"]},
    {"id": "C12", "name": "UserDAO (login validation, user create)", "evidence": ["app/data/user-dao.js"]},
    {"id": "C13", "name": "ProfileDAO", "evidence": ["app/data/profile-dao.js"]},
    {"id": "C14", "name": "AllocationsDAO ($where query builder)", "evidence": ["app/data/allocations-dao.js"]},
    {"id": "C15", "name": "ContributionsDAO", "evidence": ["app/data/contributions-dao.js"]},
    {"id": "C16", "name": "BenefitsDAO", "evidence": ["app/data/benefits-dao.js"]},
    {"id": "C17", "name": "MemosDAO", "evidence": ["app/data/memos-dao.js"]},
    {"id": "C18", "name": "Swig templating engine (autoescape disabled)", "evidence": ["server.js", "app/views/memos.html"]},
    {"id": "C19", "name": "Application configuration loader", "evidence": ["config/config.js", "config/env/all.js"]},
    {"id": "C20", "name": "DB reset / seed script", "evidence": ["artifacts/db-reset.js"]},
    {"id": "C21", "name": "Docker / Compose deployment", "evidence": ["Dockerfile", "docker-compose.yml"]}
  ],
  "data_stores": [
    {"id": "D1", "name": "MongoDB users collection (credentials, SSN, DOB, bank data)", "evidence": ["app/data/user-dao.js", "app/data/profile-dao.js", "artifacts/db-reset.js"]},
    {"id": "D2", "name": "MongoDB allocations collection", "evidence": ["app/data/allocations-dao.js"]},
    {"id": "D3", "name": "MongoDB contributions collection", "evidence": ["app/data/contributions-dao.js"]},
    {"id": "D4", "name": "MongoDB memos collection (shared across all users)", "evidence": ["app/data/memos-dao.js"]},
    {"id": "D5", "name": "MongoDB counters collection", "evidence": ["app/data/user-dao.js", "artifacts/db-reset.js"]},
    {"id": "D6", "name": "In-memory (MemoryStore) session store", "evidence": ["server.js"]},
    {"id": "D7", "name": "Committed TLS private key & certificate", "evidence": ["artifacts/cert/server.key", "artifacts/cert/server.crt"]}
  ],
  "entry_points": [
    {"id": "E1", "name": "POST /login", "evidence": ["app/routes/index.js", "app/routes/session.js"]},
    {"id": "E2", "name": "POST /signup", "evidence": ["app/routes/index.js", "app/routes/session.js"]},
    {"id": "E3", "name": "GET /logout", "evidence": ["app/routes/index.js", "app/routes/session.js"]},
    {"id": "E4", "name": "GET /dashboard", "evidence": ["app/routes/index.js", "app/routes/session.js"]},
    {"id": "E5", "name": "GET /profile", "evidence": ["app/routes/index.js", "app/routes/profile.js"]},
    {"id": "E6", "name": "POST /profile", "evidence": ["app/routes/index.js", "app/routes/profile.js"]},
    {"id": "E7", "name": "POST /contributions", "evidence": ["app/routes/index.js", "app/routes/contributions.js"]},
    {"id": "E8", "name": "GET /contributions", "evidence": ["app/routes/index.js", "app/routes/contributions.js"]},
    {"id": "E9", "name": "GET /allocations/:userId", "evidence": ["app/routes/index.js", "app/routes/allocations.js"]},
    {"id": "E10", "name": "GET /benefits", "evidence": ["app/routes/index.js", "app/routes/benefits.js"]},
    {"id": "E11", "name": "POST /benefits", "evidence": ["app/routes/index.js", "app/routes/benefits.js"]},
    {"id": "E12", "name": "POST /memos", "evidence": ["app/routes/index.js", "app/routes/memos.js"]},
    {"id": "E13", "name": "GET /memos", "evidence": ["app/routes/index.js", "app/routes/memos.js"]},
    {"id": "E14", "name": "GET /learn (open redirect)", "evidence": ["app/routes/index.js"]},
    {"id": "E15", "name": "GET /research (SSRF via url+symbol)", "evidence": ["app/routes/index.js", "app/routes/research.js"]},
    {"id": "E16", "name": "GET /tutorial/*", "evidence": ["app/routes/index.js", "app/routes/tutorial.js"]},
    {"id": "E17", "name": "Static asset serving /app/assets", "evidence": ["server.js"]}
  ],
  "trust_boundaries": [
    {"id": "TB1", "name": "Internet -> Express HTTP listener (no TLS)", "evidence": ["server.js"]},
    {"id": "TB2", "name": "Authenticated session boundary (isLoggedIn middleware)", "evidence": ["app/routes/index.js", "app/routes/session.js"]},
    {"id": "TB3", "name": "Admin authorization boundary (isAdmin middleware, unused on /benefits)", "evidence": ["app/routes/index.js", "app/routes/session.js"]},
    {"id": "TB4", "name": "Application -> MongoDB (no auth on container DB)", "evidence": ["config/env/all.js", "docker-compose.yml"]},
    {"id": "TB5", "name": "Application -> external HTTP fetch (needle to attacker-supplied URL)", "evidence": ["app/routes/research.js"]}
  ],
  "external_deps": [
    {"id": "X1", "name": "mongodb driver ^2.1.18 (legacy, supports $where JS exec)", "evidence": ["package.json", "app/data/allocations-dao.js"]},
    {"id": "X2", "name": "marked 0.3.5 (outdated, sanitize option deprecated/bypassable)", "evidence": ["package.json", "server.js", "app/views/memos.html"]},
    {"id": "X3", "name": "swig ^1.4.2 (unmaintained templating engine)", "evidence": ["package.json", "server.js"]},
    {"id": "X4", "name": "needle 2.2.4 (HTTP client used for SSRF sink)", "evidence": ["package.json", "app/routes/research.js"]},
    {"id": "X5", "name": "bcrypt-nodejs 0.0.3 (deprecated; not actually used for storage)", "evidence": ["package.json", "app/data/user-dao.js"]},
    {"id": "X6", "name": "express-session ^1.13.0 (default MemoryStore, insecure cookie flags)", "evidence": ["package.json", "server.js"]},
    {"id": "X7", "name": "node:12-alpine base image (EOL Node.js runtime)", "evidence": ["Dockerfile"]}
  ]
}
