{
  "system_name": "crAPI (Completely Ridiculous API)",
  "components": [
    {"id": "C1", "name": "Web/SPA + nginx reverse proxy (React, nginx)", "evidence": ["services/web/nginx.conf.template", "services/web/package.json", "deploy/docker/docker-compose.yml"]},
    {"id": "C2", "name": "Identity service (Java/Spring Boot, JWT/auth/user/vehicle)", "evidence": ["services/identity/src/main/java/com/crapi/controller/AuthController.java", "services/identity/src/main/java/com/crapi/config/WebSecurityConfig.java"]},
    {"id": "C3", "name": "Community service (Go, gorilla/mux, posts/coupons)", "evidence": ["services/community/api/router/routes.go", "services/community/api/controllers/post_controller.go"]},
    {"id": "C4", "name": "Workshop service (Python/Django DRF, shop/mechanic/merchant)", "evidence": ["services/workshop/crapi/shop/views.py", "services/workshop/crapi_site/settings.py"]},
    {"id": "C5", "name": "Chatbot LLM agent (Flask + LangGraph, SQL+MCP+RAG tools)", "evidence": ["services/chatbot/src/chatbot/langgraph_agent.py", "services/chatbot/src/chatbot/chat_api.py"]},
    {"id": "C6", "name": "MCP server (FastMCP, OpenAPI-derived tools over crAPI)", "evidence": ["services/chatbot/src/mcpserver/server.py", "services/chatbot/src/mcpserver/auth/middleware.py"]},
    {"id": "C7", "name": "Gateway service (api.mypremiumdealership.com payment mock)", "evidence": ["services/gateway-service/server.crt", "deploy/docker/docker-compose.yml"]},
    {"id": "C8", "name": "MailHog SMTP/web mail catcher", "evidence": ["services/mailhog", "deploy/docker/docker-compose.yml"]}
  ],
  "data_stores": [
    {"id": "D1", "name": "PostgreSQL (users, vehicles, orders, OTP, applied coupons)", "evidence": ["deploy/docker/docker-compose.yml", "services/workshop/crapi_site/settings.py", "services/identity/src/main/java/com/crapi/repository/UserRepository.java"]},
    {"id": "D2", "name": "MongoDB (community posts/comments/coupons, mailhog storage)", "evidence": ["services/community/api/config/Initialize_mongo.go", "services/workshop/crapi_site/settings.py", "deploy/docker/docker-compose.yml"]},
    {"id": "D3", "name": "ChromaDB vector store (RAG embeddings for chatbot)", "evidence": ["deploy/docker/docker-compose.yml", "services/chatbot/src/chatbot/retriever_utils.py"]},
    {"id": "D4", "name": "Committed key material (JWKS RSA private key, TLS server.key, p12)", "evidence": ["services/identity/jwks.json", "deploy/docker/keys/jwks.json", "services/identity/src/main/resources/certs/server.key"]},
    {"id": "D5", "name": "Generated PDF service reports on workshop filesystem", "evidence": ["services/workshop/crapi/mechanic/views.py"]},
    {"id": "D6", "name": "Web-served debug/access log directory", "evidence": ["services/web/nginx.conf.template"]}
  ],
  "entry_points": [
    {"id": "E1", "name": "POST /identity/api/auth/login", "evidence": ["services/identity/src/main/java/com/crapi/controller/AuthController.java"]},
    {"id": "E2", "name": "POST /identity/api/auth/signup", "evidence": ["services/identity/src/main/java/com/crapi/controller/AuthController.java"]},
    {"id": "E3", "name": "POST /identity/api/auth/v2/check-otp (unlimited OTP attempts)", "evidence": ["services/identity/src/main/java/com/crapi/controller/AuthController.java", "services/identity/src/main/java/com/crapi/service/Impl/OtpServiceImpl.java"]},
    {"id": "E4", "name": "JWT/ApiKey validation path (validateJwtToken)", "evidence": ["services/identity/src/main/java/com/crapi/config/JwtProvider.java", "services/identity/src/main/java/com/crapi/config/JwtAuthTokenFilter.java"]},
    {"id": "E5", "name": "POST /identity/management/user/apikey", "evidence": ["services/identity/src/main/java/com/crapi/controller/ManagementControlller.java", "services/identity/src/main/java/com/crapi/config/WebSecurityConfig.java"]},
    {"id": "E6", "name": "GET /identity/api/v2/vehicle/{carId}/location (BOLA)", "evidence": ["services/identity/src/main/java/com/crapi/controller/VehicleController.java"]},
    {"id": "E7", "name": "GET api/v2/user/videos/convert_video (OS command injection)", "evidence": ["services/identity/src/main/java/com/crapi/controller/ProfileController.java", "services/identity/src/main/java/com/crapi/utils/BashCommand.java"]},
    {"id": "E8", "name": "DELETE /identity/api/v2/admin/videos/{video_id} (BFLA)", "evidence": ["services/identity/src/main/java/com/crapi/controller/ProfileController.java"]},
    {"id": "E9", "name": "GET /workshop/api/shop/orders/{order_id} (BOLA + payment trigger)", "evidence": ["services/workshop/crapi/shop/views.py", "services/workshop/crapi/shop/urls.py"]},
    {"id": "E10", "name": "POST /workshop/api/shop/apply_coupon (SQL injection)", "evidence": ["services/workshop/crapi/shop/views.py"]},
    {"id": "E11", "name": "POST /workshop/api/merchant/contact_mechanic (SSRF)", "evidence": ["services/workshop/crapi/merchant/views.py"]},
    {"id": "E12", "name": "GET /workshop/api/mechanic/receive_report (unauthenticated)", "evidence": ["services/workshop/crapi/mechanic/views.py", "services/workshop/crapi/mechanic/urls.py"]},
    {"id": "E13", "name": "GET /workshop/api/mechanic/download_report (path traversal attempt surface)", "evidence": ["services/workshop/crapi/mechanic/views.py"]},
    {"id": "E14", "name": "POST /community/api/v2/coupon/validate-coupon (NoSQL operator injection)", "evidence": ["services/community/api/controllers/coupon_controller.go", "services/community/api/router/routes.go"]},
    {"id": "E15", "name": "POST /community/api/v2/community/posts/{postID}/comment", "evidence": ["services/community/api/controllers/post_controller.go", "services/community/api/router/routes.go"]},
    {"id": "E16", "name": "GET /debug/pprof/* (Go profiling when DEBUG=1)", "evidence": ["services/community/api/router/routes.go"]},
    {"id": "E17", "name": "POST /chatbot chat (LLM agent invocation)", "evidence": ["services/chatbot/src/chatbot/chat_api.py", "services/chatbot/src/chatbot/langgraph_agent.py"]},
    {"id": "E18", "name": "MCP streamable HTTP endpoint :5500 (tools)", "evidence": ["services/chatbot/src/mcpserver/server.py", "deploy/docker/docker-compose.yml"]},
    {"id": "E19", "name": "GET /debug/ static log directory (nginx alias)", "evidence": ["services/web/nginx.conf.template"]},
    {"id": "E20", "name": "POST /identity/api/v2/user/reset-password / change-email", "evidence": ["services/identity/src/main/java/com/crapi/controller/UserController.java", "services/identity/src/main/java/com/crapi/controller/ChangeEmailController.java"]}
  ],
  "trust_boundaries": [
    {"id": "TB1", "name": "Internet -> nginx/web edge (only exposed ports 8888/8443/8025/5500)", "evidence": ["deploy/docker/docker-compose.yml", "services/web/nginx.conf.template"]},
    {"id": "TB2", "name": "Edge -> backend microservices (identity/community/workshop/chatbot)", "evidence": ["services/web/nginx.conf.template", "deploy/docker/docker-compose.yml"]},
    {"id": "TB3", "name": "Services -> datastores (Postgres/Mongo/Chroma, shared admin creds)", "evidence": ["deploy/docker/docker-compose.yml", "services/workshop/crapi_site/settings.py"]},
    {"id": "TB4", "name": "Chatbot/MCP agent -> crAPI APIs using hardcoded admin ApiKey (confused deputy)", "evidence": ["services/chatbot/src/mcpserver/server.py", "deploy/docker/docker-compose.yml"]},
    {"id": "TB5", "name": "Chatbot agent -> external LLM provider egress (OpenAI/Anthropic/Bedrock/etc.)", "evidence": ["services/chatbot/src/chatbot/langgraph_agent.py", "deploy/docker/docker-compose.yml"]},
    {"id": "TB6", "name": "Workshop -> external payment gateway (basic-auth, verify=False)", "evidence": ["services/workshop/crapi/shop/views.py", "services/workshop/crapi_site/settings.py"]},
    {"id": "TB7", "name": "CI/CD build & image publish supply chain (GitHub Actions)", "evidence": [".github/workflows/publish.yml", ".github/workflows/pr-build.yml"]}
  ],
  "external_deps": [
    {"id": "X1", "name": "LLM provider SDKs (langchain-openai/anthropic/aws/google/groq/mistral/cohere)", "evidence": ["services/chatbot/requirements.txt", "services/chatbot/src/chatbot/langgraph_agent.py"]},
    {"id": "X2", "name": "Java JWT libs (nimbus-jose-jwt, jjwt)", "evidence": ["services/identity/src/main/java/com/crapi/config/JwtProvider.java"]},
    {"id": "X3", "name": "Go deps incl. dgrijalva/jwt-go (deprecated), gorilla/mux, gorm, mongo-driver", "evidence": ["services/community/api/auth/token.go", "services/community/go.mod"]},
    {"id": "X4", "name": "Python deps (Django/DRF, djongo, requests, xhtml2pdf, fastmcp, langgraph)", "evidence": ["services/workshop/requirements.txt", "services/chatbot/requirements.txt"]},
    {"id": "X5", "name": "Container base images (postgres:14, mongo:4.4, chromadb/chroma:latest)", "evidence": ["deploy/docker/docker-compose.yml"]},
    {"id": "X6", "name": "SMTP / MailHog mail relay", "evidence": ["deploy/docker/docker-compose.yml", "services/identity/src/main/java/com/crapi/config/MailConfiguration.java"]}
  ]
}
