{
  "system_name": "OWASP NodeGoat",
  "components": [
    {"id": "C1", "name": "Express HTTP Server (app bootstrap, middleware, session)", "evidence": ["server.js"]},
    {"id": "C2", "name": "Routes Registrar / Auth Middleware (isLoggedIn, isAdmin)", "evidence": ["app/routes/index.js", "app/routes/session.js"]},
    {"id": "C3", "name": "Session & Auth Handler (login, signup, logout)", "evidence": ["app/routes/session.js"]},
    {"id": "C4", "name": "Profile Handler", "evidence": ["app/routes/profile.js"]},
    {"id": "C5", "name": "Contributions Handler (eval of inputs)", "evidence": ["app/routes/contributions.js"]},
    {"id": "C6", "name": "Allocations Handler", "evidence": ["app/routes/allocations.js"]},
    {"id": "C7", "name": "Benefits Handler (admin function)", "evidence": ["app/routes/benefits.js"]},
    {"id": "C8", "name": "Memos Handler (markdown)", "evidence": ["app/routes/memos.js"]},
    {"id": "C9", "name": "Research Handler (server-side fetch)", "evidence": ["app/routes/research.js", "app/data/research-dao.js"]},
    {"id": "C10", "name": "Tutorial Router", "evidence": ["app/routes/tutorial.js"]},
    {"id": "C11", "name": "Error Handler Middleware", "evidence": ["app/routes/error.js"]},
    {"id": "C12", "name": "User DAO (auth, password compare)", "evidence": ["app/data/user-dao.js"]},
    {"id": "C13", "name": "Profile DAO (SSN/DOB/bank persistence)", "evidence": ["app/data/profile-dao.js"]},
    {"id": "C14", "name": "Allocations DAO ($where query builder)", "evidence": ["app/data/allocations-dao.js"]},
    {"id": "C15", "name": "Contributions DAO", "evidence": ["app/data/contributions-dao.js"]},
    {"id": "C16", "name": "Benefits DAO", "evidence": ["app/data/benefits-dao.js"]},
    {"id": "C17", "name": "Memos DAO", "evidence": ["app/data/memos-dao.js"]},
    {"id": "C18", "name": "Swig Template Engine (autoescape off)", "evidence": ["server.js", "app/views/memos.html", "app/views/profile.html"]},
    {"id": "C19", "name": "Configuration Loader", "evidence": ["config/config.js", "config/env/all.js", "config/env/development.js"]},
    {"id": "C20", "name": "DB Reset / Seed Script", "evidence": ["artifacts/db-reset.js"]},
    {"id": "C21", "name": "Container Image / Compose Deployment", "evidence": ["Dockerfile", "docker-compose.yml"]}
  ],
  "data_stores": [
    {"id": "D1", "name": "MongoDB users collection (credentials, SSN, DOB, bank acct/routing)", "evidence": ["app/data/user-dao.js", "app/data/profile-dao.js", "app/data/benefits-dao.js"]},
    {"id": "D2", "name": "MongoDB allocations collection", "evidence": ["app/data/allocations-dao.js"]},
    {"id": "D3", "name": "MongoDB contributions collection", "evidence": ["app/data/contributions-dao.js"]},
    {"id": "D4", "name": "MongoDB memos collection", "evidence": ["app/data/memos-dao.js"]},
    {"id": "D5", "name": "MongoDB counters collection (id sequence)", "evidence": ["app/data/user-dao.js"]},
    {"id": "D6", "name": "Server-side session store (in-memory MemoryStore)", "evidence": ["server.js"]},
    {"id": "D7", "name": "Committed TLS private key & certificate", "evidence": ["artifacts/cert/server.key", "artifacts/cert/server.crt"]},
    {"id": "D8", "name": "Static assets (vendored JS/CSS)", "evidence": ["app/assets/vendor/jquery.min.js", "server.js"]}
  ],
  "entry_points": [
    {"id": "E1", "name": "POST /login", "evidence": ["app/routes/index.js", "app/routes/session.js"]},
    {"id": "E2", "name": "POST /signup", "evidence": ["app/routes/index.js", "app/routes/session.js"]},
    {"id": "E3", "name": "GET /logout", "evidence": ["app/routes/index.js", "app/routes/session.js"]},
    {"id": "E4", "name": "GET /dashboard", "evidence": ["app/routes/index.js", "app/routes/session.js"]},
    {"id": "E5", "name": "POST /profile (SSN/DOB/bank update)", "evidence": ["app/routes/index.js", "app/routes/profile.js"]},
    {"id": "E6", "name": "GET /profile", "evidence": ["app/routes/index.js", "app/routes/profile.js"]},
    {"id": "E7", "name": "POST /contributions (eval inputs)", "evidence": ["app/routes/index.js", "app/routes/contributions.js"]},
    {"id": "E8", "name": "GET /allocations/:userId (IDOR + NoSQL $where)", "evidence": ["app/routes/index.js", "app/routes/allocations.js", "app/data/allocations-dao.js"]},
    {"id": "E9", "name": "GET/POST /benefits (admin func, missing isAdmin)", "evidence": ["app/routes/index.js", "app/routes/benefits.js"]},
    {"id": "E10", "name": "POST /memos (stored markdown)", "evidence": ["app/routes/index.js", "app/routes/memos.js"]},
    {"id": "E11", "name": "GET /memos", "evidence": ["app/routes/index.js", "app/routes/memos.js"]},
    {"id": "E12", "name": "GET /learn (open redirect)", "evidence": ["app/routes/index.js"]},
    {"id": "E13", "name": "GET /research?url=&symbol= (SSRF)", "evidence": ["app/routes/index.js", "app/routes/research.js"]},
    {"id": "E14", "name": "GET /tutorial/* tutorial pages", "evidence": ["app/routes/index.js", "app/routes/tutorial.js"]},
    {"id": "E15", "name": "Static file serving from /app/assets", "evidence": ["server.js"]}
  ],
  "trust_boundaries": [
    {"id": "TB1", "name": "Internet -> Express HTTP edge (plaintext HTTP, no TLS)", "evidence": ["server.js"]},
    {"id": "TB2", "name": "Unauthenticated -> Authenticated (session middleware)", "evidence": ["app/routes/index.js", "app/routes/session.js"]},
    {"id": "TB3", "name": "Authenticated user -> Admin function (isAdmin)", "evidence": ["app/routes/session.js", "app/routes/index.js", "app/routes/benefits.js"]},
    {"id": "TB4", "name": "Application -> MongoDB data tier", "evidence": ["server.js", "docker-compose.yml", "config/env/all.js"]},
    {"id": "TB5", "name": "Application -> External market-data endpoint (outbound fetch)", "evidence": ["app/routes/research.js"]}
  ],
  "external_deps": [
    {"id": "X1", "name": "express / express-session / body-parser", "evidence": ["package.json", "server.js"]},
    {"id": "X2", "name": "mongodb driver (2.x)", "evidence": ["package.json", "server.js"]},
    {"id": "X3", "name": "swig + consolidate templating", "evidence": ["package.json", "server.js"]},
    {"id": "X4", "name": "marked (0.3.5) markdown renderer", "evidence": ["package.json", "server.js", "app/routes/memos.js"]},
    {"id": "X5", "name": "needle HTTP client", "evidence": ["package.json", "app/routes/research.js"]},
    {"id": "X6", "name": "bcrypt-nodejs (present but unused for hashing)", "evidence": ["package.json", "app/data/user-dao.js"]},
    {"id": "X7", "name": "node-esapi encoder", "evidence": ["package.json", "app/routes/profile.js"]},
    {"id": "X8", "name": "node:12-alpine base image (EOL)", "evidence": ["Dockerfile"]}
  ]
}
