{
  "system_name": "OWASP NodeGoat",
  "components": [
    {"id": "C1", "name": "Express HTTP Server", "evidence": ["server.js", "http.createServer(app).listen(port"]},
    {"id": "C2", "name": "Session/Auth Handler", "evidence": ["app/routes/session.js", "app/data/user-dao.js"]},
    {"id": "C3", "name": "Profile Handler", "evidence": ["app/routes/profile.js", "app/data/profile-dao.js"]},
    {"id": "C4", "name": "Contributions Handler", "evidence": ["app/routes/contributions.js", "app/data/contributions-dao.js"]},
    {"id": "C5", "name": "Allocations Handler", "evidence": ["app/routes/allocations.js", "app/data/allocations-dao.js"]},
    {"id": "C6", "name": "Benefits Handler", "evidence": ["app/routes/benefits.js", "app/data/benefits-dao.js"]},
    {"id": "C7", "name": "Memos Handler", "evidence": ["app/routes/memos.js", "app/data/memos-dao.js"]},
    {"id": "C8", "name": "Research/Stock Proxy Handler", "evidence": ["app/routes/research.js", "needle.get(url"]},
    {"id": "C9", "name": "Swig Template Engine", "evidence": ["server.js", "swig.setDefaults", "autoescape: false"]},
    {"id": "C10", "name": "Marked Markdown Renderer", "evidence": ["server.js", "const marked = require(\"marked\")"]},
    {"id": "C11", "name": "Error Handler Middleware", "evidence": ["app/routes/error.js", "error-template"]}
  ],
  "data_stores": [
    {"id": "D1", "name": "MongoDB (users, allocations, contributions, memos, counters)", "evidence": ["app/data/user-dao.js", "db.collection(\"users\")", "config/env/all.js"]},
    {"id": "D2", "name": "Express in-memory session store", "evidence": ["server.js", "express-session", "saveUninitialized: true"]},
    {"id": "D3", "name": "Committed TLS private key & certificate", "evidence": ["artifacts/cert/server.key", "artifacts/cert/server.crt"]},
    {"id": "D4", "name": "Hardcoded config secrets (cookieSecret, cryptoKey, ZAP API key)", "evidence": ["config/env/all.js", "cookieSecret: \"session_cookie_secret_key_here\"", "config/env/development.js"]},
    {"id": "D5", "name": "Seeded default accounts (admin/Admin_123)", "evidence": ["artifacts/db-reset.js", "\"password\": \"Admin_123\""]}
  ],
  "entry_points": [
    {"id": "E1", "name": "POST /login", "evidence": ["app/routes/index.js", "app/routes/session.js", "handleLoginRequest"]},
    {"id": "E2", "name": "POST /signup", "evidence": ["app/routes/index.js", "handleSignup"]},
    {"id": "E3", "name": "POST /profile (SSN/DOB/bank)", "evidence": ["app/routes/profile.js", "handleProfileUpdate"]},
    {"id": "E4", "name": "POST /contributions (eval)", "evidence": ["app/routes/contributions.js", "eval(req.body.preTax)"]},
    {"id": "E5", "name": "GET /allocations/:userId", "evidence": ["app/routes/allocations.js", "const { userId } = req.params"]},
    {"id": "E6", "name": "GET/POST /benefits", "evidence": ["app/routes/index.js", "app/routes/benefits.js", "updateBenefits"]},
    {"id": "E7", "name": "POST /memos", "evidence": ["app/routes/memos.js", "memosDAO.insert(req.body.memo"]},
    {"id": "E8", "name": "GET /research (url+symbol)", "evidence": ["app/routes/research.js", "req.query.url + req.query.symbol"]},
    {"id": "E9", "name": "GET /learn (redirect)", "evidence": ["app/routes/index.js", "res.redirect(req.query.url)"]}
  ],
  "trust_boundaries": [
    {"id": "TB1", "name": "Internet edge (cleartext HTTP)", "evidence": ["server.js", "http.createServer(app).listen(port"], "kind": "network"},
    {"id": "TB2", "name": "Application to MongoDB link", "evidence": ["config/env/all.js", "mongodb://localhost:27017/nodegoat", "docker-compose.yml"], "kind": "network"},
    {"id": "TB3", "name": "CI/CD & dependency supply chain", "evidence": [".github/workflows/e2e-test.yml", "package.json", "Dockerfile"], "kind": "process"},
    {"id": "TB4", "name": "Authenticated session / privilege boundary", "evidence": ["app/routes/session.js", "isLoggedInMiddleware", "isAdminUserMiddleware"], "kind": "process"}
  ],
  "external_deps": [
    {"id": "X1", "name": "marked 0.3.5", "evidence": ["package.json", "\"marked\": \"0.3.5\""], "manifest": "package.json", "risk": "known-CVE (XSS bypass in <0.3.9)"},
    {"id": "X2", "name": "swig 1.4.2", "evidence": ["package.json", "\"swig\": \"^1.4.2\""], "manifest": "package.json", "risk": "EOL/unmaintained (SSTI surface)"},
    {"id": "X3", "name": "mongodb driver 2.x", "evidence": ["package.json", "\"mongodb\": \"^2.1.18\""], "manifest": "package.json", "risk": "EOL"},
    {"id": "X4", "name": "express 4.13.4", "evidence": ["package.json", "\"express\": \"^4.13.4\""], "manifest": "package.json", "risk": "outdated"},
    {"id": "X5", "name": "bcrypt-nodejs 0.0.3", "evidence": ["package.json", "\"bcrypt-nodejs\": \"0.0.3\""], "manifest": "package.json", "risk": "archived/deprecated (not used at runtime)"},
    {"id": "X6", "name": "node-esapi 0.0.1", "evidence": ["package.json", "\"node-esapi\": \"0.0.1\""], "manifest": "package.json", "risk": "unmaintained"},
    {"id": "X7", "name": "needle 2.2.4 (SSRF sink)", "evidence": ["package.json", "app/routes/research.js"], "manifest": "package.json", "risk": "outdated"}
  ],
  "roles": [
    {"id": "anon", "name": "anonymous"},
    {"id": "user", "name": "authenticated user"},
    {"id": "admin", "name": "admin"}
  ]
}
