{
  "system_name": "crAPI (Completely Ridiculous API)",
  "components": [
    {"id": "C1", "name": "Web Frontend / Reverse Proxy (React SPA + nginx)", "evidence": ["services/web/nginx.conf.template", "services/web/package.json", "deploy/docker/docker-compose.yml"]},
    {"id": "C2", "name": "Identity Service (Java/Kotlin Spring Boot, auth/JWT/users/vehicles)", "evidence": ["services/identity/src/main/java/com/crapi/controller/AuthController.java", "services/identity/build.gradle.kts"]},
    {"id": "C3", "name": "Community Service (Go, posts/comments/coupons)", "evidence": ["services/community/main.go", "services/community/api/router/routes.go"]},
    {"id": "C4", "name": "Workshop Service (Python/Django, shop/mechanic/merchant)", "evidence": ["services/workshop/manage.py", "services/workshop/crapi/shop/views.py", "services/workshop/crapi/mechanic/views.py"]},
    {"id": "C5", "name": "Chatbot Service (Python Flask + LangGraph LLM agent)", "evidence": ["services/chatbot/src/chatbot/langgraph_agent.py", "services/chatbot/src/chatbot/chat_api.py"]},
    {"id": "C6", "name": "MCP Server (FastMCP, OpenAPI-derived tools for the LLM agent)", "evidence": ["services/chatbot/src/mcpserver/server.py", "services/chatbot/src/mcpserver/auth/middleware.py"]},
    {"id": "C7", "name": "Gateway / Payment Service (Go, api.mypremiumdealership.com, VIN ownership + payment)", "evidence": ["services/gateway-service/main.go"]},
    {"id": "C8", "name": "MailHog (SMTP catcher + web UI)", "evidence": ["services/mailhog/Dockerfile", "deploy/docker/docker-compose.yml"]},
    {"id": "C9", "name": "JWT verification fan-out (identity /api/auth/verify consumed by other services)", "evidence": ["services/identity/src/main/java/com/crapi/controller/AuthController.java", "services/community/api/auth/token.go", "services/chatbot/src/mcpserver/auth/middleware.py"]}
  ],
  "data_stores": [
    {"id": "D1", "name": "PostgreSQL (users, vehicles, orders, products, coupons applied, OTP)", "evidence": ["deploy/docker/docker-compose.yml", "services/identity/src/main/java/com/crapi/repository/UserRepository.java"]},
    {"id": "D2", "name": "MongoDB (community posts/comments/coupons, mail storage)", "evidence": ["services/community/api/config/Initialize_mongo.go", "deploy/docker/docker-compose.yml"]},
    {"id": "D3", "name": "ChromaDB (vector store for chatbot RAG embeddings)", "evidence": ["deploy/docker/docker-compose.yml", "services/chatbot/src/chatbot/retriever_utils.py"]},
    {"id": "D4", "name": "RAG knowledge corpus (instructions markdown ingested by retriever)", "evidence": ["services/chatbot/retrieval/instructions/keys.md", "services/chatbot/retrieval/instructions/users.md"]},
    {"id": "D5", "name": "JWT signing key material (committed JWKS with private RSA components)", "evidence": ["deploy/docker/keys/jwks.json", "services/identity/jwks.json"]},
    {"id": "D6", "name": "Generated service report PDFs on workshop disk (reports/ dir)", "evidence": ["services/workshop/crapi/mechanic/views.py"]}
  ],
  "entry_points": [
    {"id": "E1", "name": "POST /identity/api/auth/login", "evidence": ["services/identity/src/main/java/com/crapi/controller/AuthController.java"]},
    {"id": "E2", "name": "POST /identity/api/auth/forget-password + POST /identity/api/auth/v2/check-otp (OTP)", "evidence": ["services/identity/src/main/java/com/crapi/controller/AuthController.java"]},
    {"id": "E3", "name": "GET /identity/api/v2/user/dashboard (permitAll)", "evidence": ["services/identity/src/main/java/com/crapi/config/WebSecurityConfig.java", "services/identity/src/main/java/com/crapi/service/Impl/UserServiceImpl.java"]},
    {"id": "E4", "name": "GET /identity/api/v2/vehicle/{carId}/location (getLocationBOLA)", "evidence": ["services/identity/src/main/java/com/crapi/controller/VehicleController.java"]},
    {"id": "E5", "name": "DELETE /identity/api/v2/admin/videos/{video_id} (deleteVideoBOLA)", "evidence": ["services/identity/src/main/java/com/crapi/controller/ProfileController.java"]},
    {"id": "E6", "name": "GET /identity/api/v2/user/videos/convert_video (shell injection)", "evidence": ["services/identity/src/main/java/com/crapi/controller/ProfileController.java", "services/identity/src/main/java/com/crapi/service/Impl/ProfileServiceImpl.java"]},
    {"id": "E7", "name": "POST /identity/management/user/apikey (non-expiring API key)", "evidence": ["services/identity/src/main/java/com/crapi/controller/ManagementControlller.java", "services/identity/src/main/java/com/crapi/config/WebSecurityConfig.java"]},
    {"id": "E8", "name": "POST /community/api/v2/coupon/validate-coupon (raw bson.M body)", "evidence": ["services/community/api/controllers/coupon_controller.go"]},
    {"id": "E9", "name": "POST /community/api/v2/community/posts/{postID}/comment", "evidence": ["services/community/api/controllers/post_controller.go"]},
    {"id": "E10", "name": "GET /workshop/api/shop/orders/{order_id} (OrderControlView.get, unauthenticated)", "evidence": ["services/workshop/crapi/shop/views.py", "services/workshop/crapi/shop/urls.py"]},
    {"id": "E11", "name": "POST /workshop/api/shop/apply_coupon (raw SQL string)", "evidence": ["services/workshop/crapi/shop/views.py"]},
    {"id": "E12", "name": "POST /workshop/api/merchant/contact_mechanic (SSRF mechanic_api)", "evidence": ["services/workshop/crapi/merchant/views.py", "services/workshop/crapi/merchant/urls.py"]},
    {"id": "E13", "name": "GET /workshop/api/mechanic/receive_report (unauthenticated)", "evidence": ["services/workshop/crapi/mechanic/views.py"]},
    {"id": "E14", "name": "PUT/GET /workshop/api/mechanic/service_request/{id} (no ownership)", "evidence": ["services/workshop/crapi/mechanic/views.py", "services/workshop/crapi/mechanic/urls.py"]},
    {"id": "E15", "name": "GET /workshop/api/mechanic/download_report?filename= (path traversal attempt surface)", "evidence": ["services/workshop/crapi/mechanic/views.py"]},
    {"id": "E16", "name": "POST /chatbot (LangGraph LLM agent with SQL + MCP + RAG tools)", "evidence": ["services/chatbot/src/chatbot/chat_api.py", "services/chatbot/src/chatbot/langgraph_agent.py"]},
    {"id": "E17", "name": "MCP server HTTP app on :5500 (auth middleware)", "evidence": ["services/chatbot/src/mcpserver/server.py", "services/chatbot/src/mcpserver/auth/middleware.py"]},
    {"id": "E18", "name": "MCP tool debug_web_service (proxies arbitrary /debug/{path})", "evidence": ["services/chatbot/src/mcpserver/server.py"]},
    {"id": "E19", "name": "GET /debug/ nginx autoindex (access log exposure)", "evidence": ["services/web/nginx.conf.template"]},
    {"id": "E20", "name": "Gateway POST /v1/payment + GET /v1/vin/ownership (HTTP Basic)", "evidence": ["services/gateway-service/main.go"]},
    {"id": "E21", "name": "POST /identity/api/v2/user/pictures and /videos (file upload)", "evidence": ["services/identity/src/main/java/com/crapi/controller/ProfileController.java"]}
  ],
  "trust_boundaries": [
    {"id": "TB1", "name": "Internet to nginx edge (public ports 8888/8443/30080/30443)", "evidence": ["deploy/docker/docker-compose.yml", "services/web/nginx.conf.template"]},
    {"id": "TB2", "name": "Reverse proxy to internal microservices (east-west, unauthenticated network)", "evidence": ["services/web/nginx.conf.template", "deploy/docker/docker-compose.yml"]},
    {"id": "TB3", "name": "Application services to datastores (Postgres/Mongo/Chroma, shared admin creds)", "evidence": ["deploy/docker/docker-compose.yml", "services/community/api/config/Initialize_postgres.go"]},
    {"id": "TB4", "name": "Workshop service to external gateway (api.mypremiumdealership.com over verify=False TLS)", "evidence": ["services/workshop/crapi/shop/views.py", "deploy/docker/docker-compose.yml"]},
    {"id": "TB5", "name": "LLM agent to model providers and to its own tool surface (SQL/MCP/RAG)", "evidence": ["services/chatbot/src/chatbot/langgraph_agent.py", "deploy/docker/docker-compose.yml"]},
    {"id": "TB6", "name": "Untrusted content into the LLM (community posts, RAG corpus) - indirect prompt injection channel", "evidence": ["services/chatbot/src/mcpserver/server.py", "services/chatbot/retrieval/instructions/keys.md"]},
    {"id": "TB7", "name": "CI/CD build & publish supply chain (GitHub Actions, prebuilt images)", "evidence": [".github/workflows/publish.yml", "deploy/docker/build-all.sh"]}
  ],
  "external_deps": [
    {"id": "X1", "name": "nimbus-jose-jwt + jjwt (JWT parsing/verification in identity)", "evidence": ["services/identity/src/main/java/com/crapi/config/JwtProvider.java"]},
    {"id": "X2", "name": "dgrijalva/jwt-go (unmaintained) in community", "evidence": ["services/community/go.mod", "services/community/api/auth/token.go"]},
    {"id": "X3", "name": "Django REST Framework + xhtml2pdf/pisa + requests", "evidence": ["services/workshop/requirements.txt", "services/workshop/crapi/mechanic/views.py"]},
    {"id": "X4", "name": "LangChain / LangGraph + provider SDKs (OpenAI, Anthropic, Bedrock, Vertex, Groq, Mistral, Cohere)", "evidence": ["services/chatbot/requirements.txt", "services/chatbot/src/chatbot/langgraph_agent.py"]},
    {"id": "X5", "name": "FastMCP", "evidence": ["services/chatbot/src/mcpserver/server.py"]},
    {"id": "X6", "name": "ChromaDB image (chromadb/chroma:latest, unpinned)", "evidence": ["deploy/docker/docker-compose.yml"]},
    {"id": "X7", "name": "gorilla/mux + jinzhu/gorm (community routing/ORM)", "evidence": ["services/community/api/router/routes.go", "services/community/api/middlewares/middlewares.go"]},
    {"id": "X8", "name": "LLM model providers (external API calls with provider API keys)", "evidence": ["deploy/docker/docker-compose.yml", "services/chatbot/src/chatbot/langgraph_agent.py"]}
  ]
}
